report_id,occurred_on,city,state,country,shape,summary,reported_on,has_media,explanation,report_link
67705,08/15/1967 20:00,Westford,MA,USA,Unknown,It appeared to be a satellite until it descended over us at a low altitude and just hovered at 500ft until it ascended and continued on,12/29/2008,N,,https://nuforc.org/sighting/?id=67705
71097,08/15/1967 14:30,Scarborough (Canada),ON,Canada,Cigar,Silver Torpedo craft with two smaller silver spherical objects circling  around the mid section of longer craft,07/15/2009,N,,https://nuforc.org/sighting/?id=71097
24664,08/15/1967 14:00,Albuquerque,NM,USA,Cigar,three terrified kids,08/24/2002,N,,https://nuforc.org/sighting/?id=24664
68183,08/12/1967 19:45,Chicago,IL,USA,Triangle,saw a triangular shaped object flying low and slow following power lines on RR tracks at dusk,01/22/2009,N,,https://nuforc.org/sighting/?id=68183
45716,08/11/1967 19:00,Little Rock,AR,USA,Circle,Orange hovering object chased by Air Force jets,08/21/2005,N,,https://nuforc.org/sighting/?id=45716
38405,08/08/1967 22:00,Oxford (UK/England),,United Kingdom,Unknown,2 unidentified lights,07/30/2004,N,,https://nuforc.org/sighting/?id=38405
59395,08/08/1967 16:00,Alamosa,CO,USA,Light,Alamosa UFO disappears after flash of blinding light.,10/23/2007,N,,https://nuforc.org/sighting/?id=59395
89786,08/08/1967 11:00,Babylon,NY,USA,Circle,Circular object with lights  around perimeter hovering over  witness,06/21/2012,N,,https://nuforc.org/sighting/?id=89786
41760,08/08/1967 10:00,Middlesboro,KY,USA,Oval,the bottom was gray and as large as the fild we were in.,02/04/2005,N,,https://nuforc.org/sighting/?id=41760
142643,08/08/1967 10:00,Angra (Portuguese Azores),,Azores,Circle,UFO and alien sighting in the Azores.,08/10/2018,N,,https://nuforc.org/sighting/?id=142643
171210,08/07/1967 20:52,Queens,NY,USA,Disk,"1 hovering craft, followed by 2 others, disappearing in the blink of an eye",08/19/2022,N,,https://nuforc.org/sighting/?id=171210
46903,08/05/1967 21:00,Fort Smith,AR,USA,Chevron,Sixties mass sighiting in Fort Smith recounted by military pilot witness.,10/10/2005,N,,https://nuforc.org/sighting/?id=46903
54327,08/05/1967 21:00,Fort Smith,AR,USA,Teardrop,Unidentified objects witnessed by hundreds over Fort Smith Arkansas,01/02/2007,N,,https://nuforc.org/sighting/?id=54327
47142,08/05/1967 01:00,Fort Smith,AR,USA,Chevron,Results of research on Ft. Smith chevron sighting.,10/21/2005,N,,https://nuforc.org/sighting/?id=47142
51893,08/03/1967 21:15,Bagsværd (Denmark),,Denmark,Changing,"I WAS CARVING,THEN SUDDENDLY MY LITTLE GIRL AND SON SAID THATS NOT AN AIRPLANE, SO MY WIFE ASKED ME WHAT IT WAS..... THE CRAFT CAME STR",08/04/2006,N,,https://nuforc.org/sighting/?id=51893
67661,08/03/1967 17:00,Calgary (Calgary),AB,Canada,Disk,"Close observation of hovering saucer shaped craft about 75' above the ground.

 500 Lights On Object0: Yes",12/26/2008,N,,https://nuforc.org/sighting/?id=67661
14493,08/01/1967 21:30,Sturgeon Bay,WI,USA,Cigar,"This has happened so long ago but the event is very clear yet.  It was an evening, on the way home from watching a movie, I approached ",10/10/2000,N,,https://nuforc.org/sighting/?id=14493
84381,08/01/1967 21:30,Davis Park,NY,USA,Triangle,"3 dim lights in triangle shape, about 400 ft high, moved west to east slowly along S. shore of Fire Island, NY",10/07/2011,N,,https://nuforc.org/sighting/?id=84381
2343,08/01/1967 20:00,Downey (North American Aviation),CA,USA,,Light in sky with amazing accelleration properties.,07/05/1997,N,,https://nuforc.org/sighting/?id=2343
47486,08/01/1967 19:00,Roseburg,OR,USA,Sphere,"3 round craft , with red-blue-green swirling lights, ( no sound) , and sparks emitting from beneath them.",11/06/2005,N,,https://nuforc.org/sighting/?id=47486
43737,08/01/1967 19:00,Coxsackie,NY,USA,Circle,"Greenish-red, hazy, circular object hangs in sky almost like a ""bat signal"" in Coxsackie, New York.",04/30/2005,N,,https://nuforc.org/sighting/?id=43737
44795,08/01/1967 19:00,New York City (Queens)(Middle Village),NY,USA,Diamond,Foreign Object Just Whizzing By Lights Up the Sky in the Summer of the Late 60's.,07/06/2005,N,,https://nuforc.org/sighting/?id=44795
14093,08/01/1967 15:30,Marathon County,WI,USA,Disk,A very close and long encounter by my family in a very rural farm in wisconsin.,09/12/2000,N,,https://nuforc.org/sighting/?id=14093
57056,08/01/1967 05:30,Far East,,Far East,Oval,Object performed impossible maneuver at extreme altitude,06/13/2007,N,,https://nuforc.org/sighting/?id=57056
127897,08/01/1967 01:00,Brawley,CA,USA,Disk,Aircraft was hovering about 20 ft. sucking water from canal.,06/16/2016,N,,https://nuforc.org/sighting/?id=127897
47128,07/31/1967 22:30,Wadsworth,OH,USA,Other,It travelled too fast to be man made.,10/21/2005,N,,https://nuforc.org/sighting/?id=47128
15714,07/31/1967 18:15,Churchville,NY,USA,Disk,That night I witnessed a UFO changed my life forever. There have been unbelievable events ever since in my life.,01/01/2001,N,,https://nuforc.org/sighting/?id=15714
5896,07/20/1967 20:00,West Palm Beach,FL,USA,Fireball,Object came from southwest horizon heading northeast.  Brightly colored as if burning.,03/12/1999,N,,https://nuforc.org/sighting/?id=5896
34365,07/20/1967 09:00,West Lake,ME,USA,Circle,I SAW A ORANGE GLOW LIGHT IN THE DEEP WOODS AT NIGHT MOVING SLOWLY AND CLOSE TO THE TREE TOPS 2 OF MY BUDDIES AT CAMP SAW IT ALSO,01/08/2004,N,,https://nuforc.org/sighting/?id=34365
11667,07/16/1967 20:45,Crystal Beach,TX,USA,Disk,"Spent a sunday in July 1967 at Crystal Beach with friends, at dusk I spotted what appeared to be a speed boat in the Gulf heading towar",01/13/2000,N,,https://nuforc.org/sighting/?id=11667
54836,07/16/1967 14:00,Barboursville,WV,USA,Sphere,"Spherical UFO, fall of 1967, Barboursville,W.Va.",01/19/2007,N,,https://nuforc.org/sighting/?id=54836
84846,07/15/1967 21:45,Sacramento,CA,USA,Light,Single star-like object splitting into three star-like objects and moving uniformly across the sky.,10/26/2011,N,,https://nuforc.org/sighting/?id=84846
42578,07/15/1967 20:00,Lakeville/Limerock,CT,USA,Formation,"It was like the movie Close Encounters in the beginning with the lights in the Clouds,,but it was 1967,,,66",02/28/2005,N,,https://nuforc.org/sighting/?id=42578
35833,07/15/1967 19:00,Boydstown,PA,USA,Disk,Clear view in daylight,03/26/2004,N,,https://nuforc.org/sighting/?id=35833
74898,07/15/1967 12:00,Calgary (Canada),AB,Canada,Sphere,"Daylight sighting of metallic sphere over golf course in Calgary, Alberta in Summer of late 1960's.",04/05/2010,N,,https://nuforc.org/sighting/?id=74898
35909,07/15/1967 03:00,Carmichaels,PA,USA,Chevron,"In 1967 our town was celebrating it's bi-centanial, a month long celebration which included several events including a temporary museum",03/30/2004,N,,https://nuforc.org/sighting/?id=35909
37399,07/15/1967 02:00,Marshfield,WI,USA,Disk,"When I was a kid, not unlike most… I enjoyed sleeping outdoors with my friends to watch shooting stars and satellites while gazing at t",06/05/2004,N,,https://nuforc.org/sighting/?id=37399
39141,07/12/1967 02:00,Wyoming (rural),WY,USA,Cigar,My father was an over the road truck driver. I was just a young boy. When he returned from his week long run he told my mom he had seen,09/06/2004,N,,https://nuforc.org/sighting/?id=39141
166818,07/10/1967 13:00,leading tickles,NL,Canada,Unknown,over cemetery a blinding light shining at me,02/20/2022,N,,https://nuforc.org/sighting/?id=166818
42165,07/05/1967 20:45,Fort Smith,AR,USA,Triangle,"Triangular lighted hovering object over Fort Smith, Arkansas in 1967 or 1968",02/24/2005,N,,https://nuforc.org/sighting/?id=42165
129839,07/02/1967 01:00,Vancouver,WA,USA,Oval,"When I was in middle school the summer of 1967 my buddy and I were camping in my back yard.

Around 1:00 am we decided to take a walk",09/09/2016,N,,https://nuforc.org/sighting/?id=129839
16209,07/01/1967 22:30,Colorado Springs,CO,USA,Triangle,Triangular object in 1967,02/06/2001,N,,https://nuforc.org/sighting/?id=16209
135375,07/01/1967 22:00,Greenville,DE,USA,Disk,"1967 16 year old boy and date see UFO close up in Greenville, Delaware.",07/26/2017,N,,https://nuforc.org/sighting/?id=135375
3025,07/01/1967 20:30,East Hanover,NJ,USA,Cigar,"no moon,observed colored blinking lights apox.     150' up in southern sky.",01/12/1998,N,,https://nuforc.org/sighting/?id=3025
108243,07/01/1967 15:00,Corpus Christi,TX,USA,Other,MIB event.,03/31/2014,N,,https://nuforc.org/sighting/?id=108243
37396,07/01/1967 01:00,Chatfield,MN,USA,Unknown,"No sighting, but strange sounds and flickering lights after midnight.",06/05/2004,N,,https://nuforc.org/sighting/?id=37396
45557,07/01/1967 00:00,Maury Mountains,OR,USA,Fireball,Possible Crashed UFO In Oregon's Maury Mountains In The Summer Of 1967.,08/10/2005,N,,https://nuforc.org/sighting/?id=45557
157265,06/30/1967 22:00,Vandenberg AFB,CA,USA,Disk,Unknown object approached icbm silo from Pacific Ocean and hovered over Minuteman silo.,07/01/2020,N,,https://nuforc.org/sighting/?id=157265
71254,06/30/1967 22:00,New Market,AL,USA,Triangle,Discs in V-formation flying over Northern Alabama in the summer of 1967,07/23/2009,N,,https://nuforc.org/sighting/?id=71254
89436,06/30/1967 22:00,Olongapo (Philippines),,Philippines,Sphere,The bottom was straight and the top was round like a half shaped moon.  ((NUFORC Note:  Air Traffic Controller report.  PD)),06/07/2012,N,,https://nuforc.org/sighting/?id=89436
68511,06/30/1967 22:00,Glenview,IL,USA,Circle,"Large ball of light hovering above the road in Glenview, Illinois - 25 - 30 observers - 1967 or 1968.",02/08/2009,N,,https://nuforc.org/sighting/?id=68511
124892,06/30/1967 22:00,out at sea east coast U.S.,,Internatonal Waters,Light,UFO spotted by U.S Navy ship out at sea in the year of 1967.,12/24/2015,N,,https://nuforc.org/sighting/?id=124892
83437,06/30/1967 22:00,Ft. Lewis,WA,USA,Light,"We noticed three points of light that came together to form a triangle, hovered there, and then streaked off in different directions.",08/25/2011,N,,https://nuforc.org/sighting/?id=83437
33564,06/30/1967 21:30,Aiken,SC,USA,Oval,Strange oval shaped silent metallic object about 2000 feet ovrehead with four oscillating lights,12/02/2003,N,,https://nuforc.org/sighting/?id=33564
62604,06/30/1967 21:00,Lansing,KS,USA,Light,Silent light darts to avoid collision.,04/17/2008,N,,https://nuforc.org/sighting/?id=62604
58022,06/30/1967 21:00,Schofield Barracks,HI,USA,Circle,"Luminescent disk traveling at fantastic speed over ocean near Schofield barracks, Hawaii",08/07/2007,N,,https://nuforc.org/sighting/?id=58022
109781,06/30/1967 20:00,Reidsville,NC,USA,Circle,"Round, ball like object, red with yellow streaks moves over tree tops.",05/27/2014,N,,https://nuforc.org/sighting/?id=109781
49391,06/30/1967 20:00,Slidell,LA,USA,Circle,I appreciate this forum to report what I saw. I was a young lad who went outside to feed the dog in the back yard. While walking back t,03/02/2006,N,,https://nuforc.org/sighting/?id=49391
52101,06/30/1967 19:00,Portmouth,RI,USA,Disk,Luminous disc shaped tilted object with aura/haze around it,08/21/2006,N,,https://nuforc.org/sighting/?id=52101
128935,06/30/1967 18:00,Waterford,PA,USA,Sphere,"My mother and her sister, now in their late 50's went to a field together when they were under ten years of age. They lived on farm lan",07/31/2016,N,,https://nuforc.org/sighting/?id=128935
129395,06/30/1967 16:00,Weirton,WV,USA,Sphere,"Green glowing object in the summer in the mid 1960's, west of Pittsburgh.",08/20/2016,N,,https://nuforc.org/sighting/?id=129395
89722,06/30/1967 13:00,Pine River,MN,USA,Light,Grays i seen when a small child,06/20/2012,N,,https://nuforc.org/sighting/?id=89722
161402,06/30/1967 10:00,Jacksonville,NC,USA,Circle,Students see UFO floating above Gymnasium of  Jacksonville N.C. School for 20 seconds,12/31/2020,N,,https://nuforc.org/sighting/?id=161402
60350,06/30/1967 09:00,Goleta,CA,USA,Unknown,Chased by Grays in Santa Barbara in 1967,12/12/2007,N,,https://nuforc.org/sighting/?id=60350
144137,06/30/1967 04:00,Saugas,CA,USA,,"In 1967 I am a little kid now. I am sleeping I am awoke by movement. I am so scared what is on my bed, something is moving.",12/19/2018,N,,https://nuforc.org/sighting/?id=144137
71690,06/30/1967 03:00,Oakwood (Dayton),OH,USA,Circle,"In the forty years since, I have yet to see anything that will explain away what I witnessed in the middle of the night.",08/16/2009,N,,https://nuforc.org/sighting/?id=71690
36686,06/30/1967 03:00,Lander,WY,USA,Light,"They were just lights, but very curious lights at that.",05/02/2004,N,,https://nuforc.org/sighting/?id=36686
115358,06/30/1967 01:00,Columbus,OH,USA,,"Fifty feet from my driveway, up to my left, out of the north sky came a large lighted object.",11/14/2014,N,,https://nuforc.org/sighting/?id=115358
61089,06/30/1967 01:00,Kansas city,KS,USA,Other,"Wyandotte county Kansas 1967 object appeared as aircraft suspended midair.

 500 Lights On Object0: Yes",01/22/2008,N,,https://nuforc.org/sighting/?id=61089
19216,06/30/1967 00:00,Peoria,IL,USA,Disk,2 or 3 saucers flying in formation in the sky during the day that shot off quickly.,08/21/2001,N,,https://nuforc.org/sighting/?id=19216
34021,06/27/1967 23:00,Glendale,AZ,USA,Light,"Glendale, AZ, 11:00 Pm, white sphere silently appeared in sky, It moved to 12 "" in front of my face, flew off.",12/20/2003,N,,https://nuforc.org/sighting/?id=34021
58655,06/25/1967 13:00,none,MI,USA,Disk,daylight disk at 200 meters.,09/09/2007,N,,https://nuforc.org/sighting/?id=58655
37377,06/23/1967 22:30,Boise,ID,USA,Light,"Light landing on runway, traveling past end zone, travelling overland over roadless area then turning to merge into freeway traffice",06/05/2004,N,,https://nuforc.org/sighting/?id=37377
44366,06/20/1967 18:00,Fairfield,CA,USA,Cigar,I believe,06/11/2005,N,,https://nuforc.org/sighting/?id=44366
180079,06/20/1967 01:00,Hinton,WV,USA,Other,I saw a gray alien 4-4.5 feet tall that walked into our cabin at the camp.,01/16/2024,N,,https://nuforc.org/sighting/?id=180079
145884,06/20/1967 01:00,High Point State Park,NJ,USA,Disk,2 glowing discs,04/26/2019,N,,https://nuforc.org/sighting/?id=145884
66533,06/15/1967 23:00,Baker,OR,USA,Disk,Disk shaped object with different colored revolving lights,10/29/2008,N,,https://nuforc.org/sighting/?id=66533
108705,06/15/1967 22:00,Lake Magog (Canada),QC,Canada,Disk,Fast moving white object zig-zags across lake stops beside tree top (orange saucer) for a short time then shoots into sky.,04/16/2014,N,,https://nuforc.org/sighting/?id=108705
163552,06/15/1967 22:00,Oak Ridge,TN,USA,Disk,Spotted 5 or 6 diffusely white-lit spheres arranged concentrically hovering overhead,05/31/2021,N,,https://nuforc.org/sighting/?id=163552
29419,06/15/1967 22:00,Savannah,GA,USA,Chevron,Five orange glowing spheres together in a line above the treetops.,06/26/2003,N,,https://nuforc.org/sighting/?id=29419
28659,06/15/1967 22:00,St. Williams (Canada),ON,Canada,Cigar,cigar shaped with red and green lights going from one end to the other. Then it was gone.,05/03/2003,N,,https://nuforc.org/sighting/?id=28659
168348,06/15/1967 21:30,Southbury,CT,USA,Disk,"HUGE craft, the most luminous thing I have ever seen (looked like a mothership). The brightness is almost indescribable.",05/16/2022,N,,https://nuforc.org/sighting/?id=168348
3584,06/15/1967 20:30,Salt Lake City,UT,USA,Disk,In June of 1967 while waiting in our car to get into a drive-in movie a saucer shaped craft hovered between us and the Wasatch Mountain,05/23/1998,N,,https://nuforc.org/sighting/?id=3584
55800,06/15/1967 20:00,Arbuckle,CA,USA,Triangle,"At dusk in 1966 or 67, three lights in formation or triangular craft with no visible substance floated silently into the West.",03/18/2007,N,,https://nuforc.org/sighting/?id=55800
97166,06/15/1967 19:30,Oak Ridge,TN,USA,Sphere,Red Sphere in Oak Ridge.,04/14/2013,N,,https://nuforc.org/sighting/?id=97166
5733,06/15/1967 14:00,Glens Falls,NY,USA,Teardrop,Passed over our backyard,02/27/1999,N,,https://nuforc.org/sighting/?id=5733
20616,06/15/1967 12:00,Edison,NJ,USA,Other,the object was one color.orange,11/30/2001,N,,https://nuforc.org/sighting/?id=20616
31280,06/15/1967 08:00,China Lake,CA,USA,Sphere,a silver sphere was filmed with a high speed tracking camera with data bar the sphere was 30 ft in diamer flying at 1900mph at a range,09/07/2003,N,,https://nuforc.org/sighting/?id=31280
170266,06/15/1967 03:30,Roseville,MI,USA,Unknown,I was born in1956 and happened before I started school.I taken from my home and my mother found me in the basement screaming,07/05/2022,N,,https://nuforc.org/sighting/?id=170266
31358,06/15/1967 03:00,Detroit,MI,USA,Sphere,huge metal ball shaped ship hanging low in air then moved away at 2 o'clock angle at great speed.,09/10/2003,N,,https://nuforc.org/sighting/?id=31358
61196,06/15/1967 02:00,Highway,AZ,USA,Circle,1967 UFO somewhere between Utah and So. Calif. over highway finally reported!,01/25/2008,N,,https://nuforc.org/sighting/?id=61196
116969,06/15/1967 01:00,Powell,OH,USA,Disk,UFO hovers right overhead while I walk alone at night,01/26/2015,N,,https://nuforc.org/sighting/?id=116969
21416,06/15/1967 00:30,Kent,WA,USA,Disk,IN THE SUMMER OF 1967 I saw a saucer at 35 feet above my car! I saw things that were  were concidered impossable for that time period. ,01/13/2002,N,,https://nuforc.org/sighting/?id=21416
24021,06/15/1967 00:00,DeSoto,KS,USA,Light,A fast moving light tracking in straight lines appeared in the northern skies........ ((anonymous report)),07/29/2002,N,,https://nuforc.org/sighting/?id=24021
60254,06/14/1967 15:30,Thomasville,GA,USA,Other,2 young men see strange barbell ufo in clear blue dauytime sky at low level.,12/09/2007,N,,https://nuforc.org/sighting/?id=60254
16678,06/12/1967 22:00,Poteau,OK,USA,Light,Light changing color darting back and forth across the sky.,02/27/2001,N,,https://nuforc.org/sighting/?id=16678
48107,06/10/1967 19:00,El Paso,TX,USA,Light,2 objects dock -stay together 10 minutes then seperate in different directions -gain altitude until out of sight,11/27/2005,N,,https://nuforc.org/sighting/?id=48107
82436,06/09/1967 23:00,Camelon (UK/Scotland),,United Kingdom,Sphere,Sphere,07/13/2011,N,,https://nuforc.org/sighting/?id=82436
170075,06/07/1967 11:00,Ipswich,Suffolk,United Kingdom,Circle,"ufo sighting ipswich uk in the 60,s",06/26/2022,N,,https://nuforc.org/sighting/?id=170075
36042,06/06/1967 12:00,Cedar Rapids,IA,USA,Oval,Bright-as-chrome object hovering,04/07/2004,N,,https://nuforc.org/sighting/?id=36042
25407,06/05/1967 14:00,Tacoma,WA,USA,Other,These were black half spheres in a triangular formation,10/04/2002,N,,https://nuforc.org/sighting/?id=25407
87822,06/04/1967 20:30,Decatur,AL,USA,Light,"Strange light shivered across sky, stopped overhead, tried to land, stopped, and then took off out of sight in 2 seconds.",03/19/2012,N,,https://nuforc.org/sighting/?id=87822
164703,06/03/1967 10:00,Lima,OH,USA,Cigar,"I was 16 years old.  On a sunny mid-morning I was alone, walking westward in an open alleyway between North Street and Oakland Parkway",09/30/2021,N,,https://nuforc.org/sighting/?id=164703
16538,06/01/1967 23:59,Boise,ID,USA,Disk,Large Mining UFO mining resourses on Earth,02/18/2001,N,,https://nuforc.org/sighting/?id=16538
59719,06/01/1967 23:00,Ventura,CA,USA,Cigar,Sighted light surrounding unknown being and heard sounds as being attempted to look inside home.,11/09/2007,N,,https://nuforc.org/sighting/?id=59719
5547,06/01/1967 23:00,Hyde Park,PA,USA,Other,"Was 12 years old,walking to buddies home it was dark.all sudden bright lights in the sky.Look like satlight maybe one mile above me.To ",01/17/1999,N,,https://nuforc.org/sighting/?id=5547
64784,06/01/1967 22:00,Laddonia,MO,USA,Unknown,Seeking Laddonia MO residents who witnessed UFO's on 3 consecutive nights 1967,07/25/2008,N,,https://nuforc.org/sighting/?id=64784
36242,06/01/1967 22:00,Gerry,NY,USA,Disk,"1967 object seen in gerry, new york made no noise as it flew  in the sky.",04/11/2004,N,,https://nuforc.org/sighting/?id=36242
89797,06/01/1967 22:00,Yucca Valley,CA,USA,Light,"6 family members observe bright light for 5 minutes near Yucca Valley, CA 1967",06/21/2012,N,,https://nuforc.org/sighting/?id=89797
16165,06/01/1967 21:00,Cincinnati,OH,USA,Cigar,i was a young girl and i know what a blimp looks like and this was NOT a blimp,02/03/2001,N,,https://nuforc.org/sighting/?id=16165
172513,06/01/1967 21:00,Toronto,ON,Canada,Star,Looked like a star moving at right angles,10/18/2022,N,,https://nuforc.org/sighting/?id=172513
3057,06/01/1967 21:00,Sumner,WA,USA,Formation,5 objects seen over Sumner WA June of 1967. Objects hovered very close to ground and shined lights.,01/28/1998,N,,https://nuforc.org/sighting/?id=3057
84867,06/01/1967 20:30,Myrtle Creek,OR,USA,Circle,10 PM August 1967 sphere observed by multiple witnesses moving along ridgleline 1/2 mile distance  500 Lights On Object0: Yes,10/26/2011,N,,https://nuforc.org/sighting/?id=84867
13176,06/01/1967 20:00,West Bend,WI,USA,Light,Orange neon brilliance round.,06/25/2000,N,,https://nuforc.org/sighting/?id=13176
56611,06/01/1967 19:30,Viet Nam (off coast),,Vietnam,Light,Submerged light under aircraft carrier.,05/10/2007,N,,https://nuforc.org/sighting/?id=56611
29239,06/01/1967 18:00,Cordova,AL,USA,Disk,"very large craft, siting dead still in mid air ,very low and in broad daylight, could see the seams in the metal",06/16/2003,N,,https://nuforc.org/sighting/?id=29239
182330,06/01/1967 18:00,Burlington,VT,USA,Circle,Hovering over driveway,07/19/2024,N,,https://nuforc.org/sighting/?id=182330
181966,06/01/1967 18:00,Clinton,IA,USA,Disk,As a child playing outside with neighborhood kids at dusk we all saw a low slow silent object with flashing red green lights circling,06/20/2024,N,,https://nuforc.org/sighting/?id=181966
116580,06/01/1967 17:00,Marion,NC,USA,Sphere,"In 1967,  I saw a flying/floating brown sphere.  ((NUFORC Note:  Report from retired Deputy Sheriff.  PD))",01/08/2015,N,,https://nuforc.org/sighting/?id=116580
16297,06/01/1967 16:00,Red Oak,IA,USA,Light,"Two unidentified extremely bright lights, one large - one smaller, clearly visible on a sunny clear day, moving at incredible speed..",02/06/2001,N,,https://nuforc.org/sighting/?id=16297
32713,06/01/1967 16:00,Warrensburg on Highway 13,MO,USA,Other,"MISSOURI INVESTIGATORS GROUP Report:  We saw two parallel lights cross in front of our windshield very, very rapidly.",10/27/2003,N,,https://nuforc.org/sighting/?id=32713
163836,06/01/1967 15:00,Tacoma,WA,USA,Oval,3 objects hovering & flew away too fast to be man made,06/27/2021,N,,https://nuforc.org/sighting/?id=163836
51868,06/01/1967 14:00,El Cerrito,CA,USA,Oval,"My wife and I saw a flying saucer, which was at about 2000 ft. sitting still.  It was oval shape, silver, and looked like something you",08/03/2006,N,,https://nuforc.org/sighting/?id=51868
78043,06/01/1967 12:00,San Diego,CA,USA,Circle,"June 1967,   2  mirrored  objects appeared miles overhead and  were motionless for about 10 minutes then going straight up and dissappe",09/28/2010,N,,https://nuforc.org/sighting/?id=78043
61498,06/01/1967 06:00,Fort Knox,KY,USA,Cylinder,"((HOAX??))  Fort Knox , Kentucky, Sighting.",02/09/2008,N,,https://nuforc.org/sighting/?id=61498
74221,06/01/1967 06:00,St. Paul,MN,USA,Disk,Fighter Jet chases UFO,01/28/2010,N,,https://nuforc.org/sighting/?id=74221
12256,06/01/1967 01:00,Edgemoor,SC,USA,Disk,Myself and 3 friends witnessed a circular shaped craft in the spring of 1967 hovering over a railroad track.,03/12/2000,N,,https://nuforc.org/sighting/?id=12256
23075,06/01/1967 00:00,Farmersville,OH,USA,Circle,What my parents do not lie.,05/31/2002,N,,https://nuforc.org/sighting/?id=23075
78118,06/01/1967 00:00,Bangor,ME,USA,,Craft landing behind Bangor State Hospital with associated garage door openings and closings in 1967.,10/02/2010,N,,https://nuforc.org/sighting/?id=78118
111743,06/01/1967 00:00,Shofield Barracks-Civilian,HI,USA,Changing,Inside.,07/21/2014,N,,https://nuforc.org/sighting/?id=111743
72079,06/01/1967 00:00,Bangor,ME,USA,,"i was watching the news on WABI-tv,bangor,maine and they had an interview with a bangor police officer, telling how he went to investig",09/05/2009,N,,https://nuforc.org/sighting/?id=72079
11705,06/01/1967 00:00,Oxen Hill,MD,USA,Sphere,"Sightings in the Washington D.C. area, number of crafts seen 3 but farther in space formation of lights. There were a number of sightin",01/16/2000,N,,https://nuforc.org/sighting/?id=11705
21871,05/29/1967 21:00,El Paso,TX,USA,Light,My Dad was a radar specialist.,02/17/2002,N,,https://nuforc.org/sighting/?id=21871
176099,05/26/1967 19:00,"open desert between Gila Bend and Crater Range, near GB AF",AZ,USA,Disk,Atop a hill set a saucer with its doorway open emitting a bright light which formed a triangle.,06/06/2023,N,,https://nuforc.org/sighting/?id=176099
52405,05/15/1967 23:00,Monroe,LA,USA,Light,My cousin's husband abd I were night fishing and saw a single light looking like a large star moving across the night sky at a pretty g,09/08/2006,N,,https://nuforc.org/sighting/?id=52405
40770,05/15/1967 20:00,Palm Wells,CA,USA,Formation,small lighted spheres apparently hovering just above the ground; about a quarter mile away,11/25/2004,N,,https://nuforc.org/sighting/?id=40770
34031,05/15/1967 20:00,Belvedere,CA,USA,Teardrop,Teardrop outlined in white light with three white circular lights inside other wise dark  interior of tear shape.,12/21/2003,N,,https://nuforc.org/sighting/?id=34031
5836,05/15/1967 19:30,Gainesville,FL,USA,Triangle,An equilateral triangle with a red glowing light on each corner (one each corner--three total. solid sillouette dark shape about the si,03/08/1999,N,,https://nuforc.org/sighting/?id=5836
123065,05/15/1967 16:00,Columbus,OH,USA,Unknown,High speed lead craft leaves three others in its wake,10/22/2015,N,,https://nuforc.org/sighting/?id=123065
