report_id,occurred_on,city,state,country,shape,summary,reported_on,has_media,explanation,report_link
82078,03/29/1964 21:00,Cherry Valley,CA,USA,Circle,Little girl wakes up to lights and sees UFO.,07/02/2011,N,,https://nuforc.org/sighting/?id=82078
84874,03/01/1964 20:00,Bristow,OK,USA,,Childhood vision of a gray.,10/26/2011,N,,https://nuforc.org/sighting/?id=84874
16253,03/01/1964 13:15,Beirut (Lebanon),,Lebanon,Sphere,"UFO was travling east to west , 500 feet  altitude ,speed was about 75 / h,it was metalic color with three antinas . it was the size of",02/05/2001,N,,https://nuforc.org/sighting/?id=16253
136996,02/15/1964 02:00,Oscoda,MI,USA,Circle,We saw the objects so many times we got use to them.,10/26/2017,N,,https://nuforc.org/sighting/?id=136996
79358,01/25/1964 20:30,Omaha,NE,USA,Orb,"Observing the first orbits of Echo 2 radar-reflective satellite through a 50 power telescope, I saw a ""lesser light"" perhaps spherical,",12/24/2010,N,,https://nuforc.org/sighting/?id=79358
144825,01/15/1964 23:30,Frankford,WV,USA,Unknown,Strobe lights and entities on ground.,02/09/2019,N,,https://nuforc.org/sighting/?id=144825
50277,01/10/1964 20:00,El Cerrito (over Old Berkeley dump),CA,USA,Fireball,bal of fire in the sky no reported air crashes that night(unexplained),04/24/2006,N,,https://nuforc.org/sighting/?id=50277
108057,12/10/1963 23:00,Rome,GA,USA,Oval,"An unmistakable sighting of a silent craft that followed us for 3miles, stopped hovered and accelerated out of sight straight up.",03/23/2014,N,,https://nuforc.org/sighting/?id=108057
2906,11/23/1963 18:00,"USS Kearsarge (at sea, out of Japan)",,Japan,Chevron,"Observed 5 lights in a inverted ""V"" rise from the horizon, hover for a few minutes and then sink back down below the horizon. We were a",11/21/1997,N,,https://nuforc.org/sighting/?id=2906
42257,11/23/1963 10:00,Thunder Bay (Canada),ON,Canada,Disk,This was not a UFO,02/24/2005,N,,https://nuforc.org/sighting/?id=42257
46981,11/01/1963 00:00,Engelwood Cliffs,NJ,USA,Unknown,"A row of bright rectangular windows with no visable exterior shape seen on 9W in Englewood Cliffs, NJ",10/13/2005,N,,https://nuforc.org/sighting/?id=46981
46518,10/20/1963 19:00,Danville,IN,USA,Disk,"UFO OVER CORNFIELD IN 1963 IN DANVILLE, IN",09/26/2005,N,,https://nuforc.org/sighting/?id=46518
17331,10/09/1963 21:30,Laurel,MS,USA,Oval,"1963 sighting of beautiful objects in southeast Mississippi , worth reading",04/20/2001,N,,https://nuforc.org/sighting/?id=17331
89814,10/04/1963 19:10,Prince George,VA,USA,Disk,"Two glowing saucers came down and floated above me and a friend; event lasted at least two hours.

 500 Lights On Object0: Yes",06/21/2012,N,,https://nuforc.org/sighting/?id=89814
34535,10/04/1963 00:00,Millington,NJ,USA,Disk,a pie shaped disc with 2red and 2 white lights closely hovering over neighbors home.,01/18/2004,N,,https://nuforc.org/sighting/?id=34535
77974,10/03/1963 21:00,New York City (Richmond Hills) (Queens),NY,USA,Circle,This thing zoomed in a zig zag motion and suddenly zoomed lightning fast up into the space of darkness.,09/24/2010,N,,https://nuforc.org/sighting/?id=77974
42309,09/20/1963 02:00,Cowichan Station (Canada),BC,Canada,Unknown,"It is my belief that some type of craft was hovering above us, it was certainly not a heliocopter.",02/24/2005,N,,https://nuforc.org/sighting/?id=42309
184750,08/30/1963 21:00,McPherson,KS,USA,Light,Light appeared over our car and followed us as we drove for 10 to 15 miles.,12/04/2024,N,,https://nuforc.org/sighting/?id=184750
44675,08/25/1963 22:00,Belchertown,MA,USA,Unknown,"Sighting occurred when I was 9 years old ... I was lying in bed , at night , when suddenly , a bright blue light lit up the room , as i",06/30/2005,N,,https://nuforc.org/sighting/?id=44675
34494,08/23/1963 22:00,Broadalbin,NY,USA,Orb,"I was 13 at the time and had a great interest in aviation,and still do with 32 yrs under my belt with USAirways.I was walking home and",01/16/2004,N,,https://nuforc.org/sighting/?id=34494
36738,08/20/1963 02:30,Camas,WA,USA,Unknown,"Prune Hill, Camas, Washington, a rural area above the Columbia River and across the river from PDX--I was in bed in a daylight basement",05/05/2004,N,,https://nuforc.org/sighting/?id=36738
36205,08/15/1963 06:00,Claycomo,MO,USA,Unknown,I observd a dark stationary object very high in the sky that also glistend in the sunlight.,04/10/2004,N,,https://nuforc.org/sighting/?id=36205
151570,08/15/1963 01:00,Sylvia,TN,USA,Disk,"Observed a saucer-shaped, metallic object hovering nearby in the middle of the night.",12/13/2019,N,,https://nuforc.org/sighting/?id=151570
171061,08/13/1963 23:00,La Canada,CA,USA,Light,Two rows of lights in a staggered formation traveling east to west at a high altitude and velocity.,08/12/2022,N,,https://nuforc.org/sighting/?id=171061
26932,08/12/1963 21:00,Riverside,OH,USA,Disk,"This craft was moving East to West at the south west corner of Wright,Patterson air force Base,there was no report.",01/07/2003,N,,https://nuforc.org/sighting/?id=26932
180013,08/12/1963 01:30,Pocatello,ID,USA,Other,perfectly round something above the house/yard,01/14/2024,N,,https://nuforc.org/sighting/?id=180013
69247,08/10/1963 22:00,Fresno,CA,USA,Other,An apparent star in the night sky which exhibited anomalous behavior,03/17/2009,N,,https://nuforc.org/sighting/?id=69247
32533,08/01/1963 22:00,Wenatchee,WA,USA,Formation,V formation of 7 to 9 lights fly from horizon to horizon,10/21/2003,N,,https://nuforc.org/sighting/?id=32533
7759,08/01/1963 22:00,Compton,CA,USA,Light,"Photoflash light, very intense, very quick, very deliberate.",05/13/1999,N,,https://nuforc.org/sighting/?id=7759
2892,08/01/1963 02:00,Amsterdam,NY,USA,Disk,"Observed 2 saucer shaped objects, traveling at high speed, vertically and horizontally.",11/19/1997,N,,https://nuforc.org/sighting/?id=2892
13426,07/20/1963 19:30,Tupelo,MS,USA,Disk,12 year old Girl and family sees Disc over high-power lines,07/13/2000,N,,https://nuforc.org/sighting/?id=13426
38641,07/17/1963 09:00,Boston,MA,USA,Triangle,"It was a nice warm night to hang on the back porch.  I saw a bright triangular light in the sky, very high up.  It was doing loops and",08/13/2004,N,,https://nuforc.org/sighting/?id=38641
162326,07/16/1963 02:00,Eastlake,OH,USA,Unknown,A bright object flew overhead and landed in a field cleared for a housing development around 2:00 AM.,03/09/2021,N,,https://nuforc.org/sighting/?id=162326
61343,07/15/1963 23:00,Portland,OR,USA,Sphere,"1963 - Round hovering, soundless, rotating object over northeast Portland, Oregon",01/31/2008,N,,https://nuforc.org/sighting/?id=61343
23620,07/15/1963 22:30,Santa Ana,CA,USA,Light,siteing of a strange object.,07/05/2002,N,,https://nuforc.org/sighting/?id=23620
55871,07/15/1963 22:00,Oklahoma City,OK,USA,Light,UFO sighting in summer of 1963 or 1964 in Oklahoma City.,03/23/2007,N,,https://nuforc.org/sighting/?id=55871
29001,07/15/1963 21:00,Virginia Beach,VA,USA,Circle,4 glowing circles 40 ft in diameter flying in rigid formation - aerial acrobatics 100 ft off the beach for > 15 minutes -many witnesses,05/31/2003,N,,https://nuforc.org/sighting/?id=29001
24305,07/15/1963 21:00,Great Lakes,IL,USA,Circle,"There were lights on the object, hovering, sparks flying, spinning in two different directions at the same time.",08/09/2002,N,,https://nuforc.org/sighting/?id=24305
28764,07/15/1963 18:00,Great Lakes,IL,USA,Disk,Couldn't believe how large it was and made no noise...,05/12/2003,N,,https://nuforc.org/sighting/?id=28764
69532,07/15/1963 10:30,Kimberling City,MO,USA,Disk,"Disc seen passing over bridge at Kimberling City, Missouri.",04/04/2009,N,,https://nuforc.org/sighting/?id=69532
45343,07/15/1963 00:00,Mantua,NJ,USA,Circle,it was 1963 during a baseball game. I had hit a single and was on first base. The first baseman (jimmy Steffens) and I were looking in,07/30/2005,N,,https://nuforc.org/sighting/?id=45343
106732,07/15/1963 00:00,Weingarten,MO,USA,Disk,Flashing amber colored lights that looked like a ferris wheel on its side.,01/28/2014,N,,https://nuforc.org/sighting/?id=106732
89783,07/14/1963 21:30,Hornell,NY,USA,Unknown,Bright object moving across the sky then stopping and going back the way it came.,06/21/2012,N,,https://nuforc.org/sighting/?id=89783
37609,07/11/1963 20:00,Albert Lea,MN,USA,Oval,It was a round blue that glowed and moved toward us slow without making any noise.,06/15/2004,N,,https://nuforc.org/sighting/?id=37609
32360,07/10/1963 20:00,Evanston,IL,USA,Disk,We watched the saucer with lights for five minutes as it remained stationary above us at about a 45 degree angle.,10/18/2003,N,,https://nuforc.org/sighting/?id=32360
173585,07/10/1963 00:30,Portland,OR,USA,Disk,"Saucer shaped, stopped overhead above us, deep glowing orange color like the coals in a fire, stayed 1-2 min., shot to horizon split se",12/26/2022,N,,https://nuforc.org/sighting/?id=173585
54777,07/03/1963 21:00,East Vassalboro,ME,USA,Triangle,Black triangle with central orange light moving slowly across sky.,01/16/2007,N,,https://nuforc.org/sighting/?id=54777
32598,07/02/1963 19:30,Tucson,AZ,USA,Other,Large blimp like object 1960's,10/23/2003,N,,https://nuforc.org/sighting/?id=32598
31387,07/01/1963 21:12,Lincoln,MO,USA,Other,This report is based upon a witness who  said that a great armada of bright lights in the Benton county sky was so bright that it was l,09/11/2003,N,,https://nuforc.org/sighting/?id=31387
38155,07/01/1963 21:00,Lincoln,MO,USA,Other,"Lights in the Sky? What are they and where did they c ome from? Benton County Missouri July 1,1963",09/17/2003,N,,https://nuforc.org/sighting/?id=38155
3044,07/01/1963 18:00,Jonesboro (Arkansas State University),AR,USA,Disk,"Craft (typical saucer style] appeared low over bldgs., sonic boom from jet from airforce base 45mi. away. Craft went straight up and ou",01/23/1998,N,,https://nuforc.org/sighting/?id=3044
37498,07/01/1963 16:00,New York City (Brooklyn),NY,USA,Oval,CRAFT FLYING ACROSS THE NEW YORK CITY SKYLINE,06/09/2004,N,,https://nuforc.org/sighting/?id=37498
58869,06/30/1963 21:00,Coventry (UK/England),,United Kingdom,Circle,Very close encounter which has changed my views on alien life forever.,09/22/2007,N,,https://nuforc.org/sighting/?id=58869
107526,06/30/1963 15:00,Canada,--,Canada,Triangle,Silent black triangle flew over our car in 1963.,02/28/2014,N,,https://nuforc.org/sighting/?id=107526
87904,06/30/1963 14:00,Anaheim,CA,USA,Disk,"First sighting 1963 disk shaped 50 foot diameter, no noise and was stable when stopped over my head.",03/20/2012,N,,https://nuforc.org/sighting/?id=87904
53061,06/30/1963 13:00,Salt Lake City,UT,USA,Disk,SAUCER5 SHAPED AND SILVER,10/24/2006,N,,https://nuforc.org/sighting/?id=53061
53717,06/30/1963 06:00,Newark,TX,USA,Disk,30 someodd years later and I finally saw proof of my early morning sighting,11/30/2006,N,,https://nuforc.org/sighting/?id=53717
68997,06/30/1963 00:00,Johnstown,PA,USA,Rectangle,"very large, stealth shaped, as big as a football field. dome  on bottom that rotated. an the dome was iluminated",02/28/2009,N,,https://nuforc.org/sighting/?id=68997
16552,06/30/1963 00:00,Zebulon,NC,USA,Other,Glowing football in night sky witnessed by five people,02/19/2001,N,,https://nuforc.org/sighting/?id=16552
177104,06/27/1963 19:11,Keego Harbor,MI,USA,Light,"Family observed two bright lights before dusk to the NW. After a while they moved in opposite directions, leaving a trail then disapp",07/29/2023,N,,https://nuforc.org/sighting/?id=177104
53932,06/27/1963 19:00,Mansfield,CT,USA,Light,again,12/11/2006,N,,https://nuforc.org/sighting/?id=53932
64958,06/26/1963 23:40,Naha (Japan),,Japan,Circle,Stealth flying craft were not developed until many years later.,08/02/2008,N,,https://nuforc.org/sighting/?id=64958
150865,06/15/1963 22:00,Indianapolis,IN,USA,Disk,"Low flying huge disc spotted in Indianapolis, IN, 1963, by a group outside at dark.",11/18/2019,N,,https://nuforc.org/sighting/?id=150865
42855,06/15/1963 22:00,Newburgh/Village of Vails Gate,NY,USA,Other,The craft  up close was enormous and turned on  a  semi -circular white light which wrapped around it's flattenend shape.,03/10/2005,N,,https://nuforc.org/sighting/?id=42855
49369,06/15/1963 21:00,Trion,GA,USA,Circle,SLOW MOWING ROUND OBJECT WITH BRIGHT LIGHTS AROUND IT-HUGH COVERING SEVERAL ACRES-LEFT IN A SPILIT SECOND- WE SWORE WE WOULD NEVER TELL,03/02/2006,N,,https://nuforc.org/sighting/?id=49369
24037,06/15/1963 21:00,Nanaimo (Canada),BC,Canada,Disk,Unidentifiable Elipitcal object,07/30/2002,N,,https://nuforc.org/sighting/?id=24037
17090,06/15/1963 19:00,Newaygo,MI,USA,Sphere,on or about june 1963 I saw a chrome ball about the size of a beachball hovering over the trees while in a boat fishing.,04/02/2001,N,,https://nuforc.org/sighting/?id=17090
44051,06/15/1963 18:15,Sacramento,CA,USA,Cylinder,Front Porch,05/20/2005,N,,https://nuforc.org/sighting/?id=44051
2926,06/15/1963 18:00,Jonesboro (Arkansas State University),AR,USA,Cigar,"Summer 1963 - First appeared the disc over building on campus  at dusk, then a sonic boom from air base 50 miles away. Craft zoomed up",11/27/1997,N,,https://nuforc.org/sighting/?id=2926
143520,06/15/1963 13:00,Grenada,MS,USA,Sphere,2 orange spheres traveling across the sky.,10/18/2018,N,,https://nuforc.org/sighting/?id=143520
146861,06/15/1963 12:00,College Park,MD,USA,Cone,"Sparking ball of color changed into Crome cone then disappeared before my eyes, I was 8 feet away from the object.",06/15/2019,N,,https://nuforc.org/sighting/?id=146861
24000,06/15/1963 11:30,North St. Paul,MN,USA,Disk,"Group of three saucer ufos sighted by five children on June 15, 1963 in North St. Paul, MN.",07/29/2002,N,,https://nuforc.org/sighting/?id=24000
106914,06/15/1963 03:33,Washougal,WA,USA,Unknown,"Small craft and several even smaller craft, with bright lights.",02/03/2014,N,,https://nuforc.org/sighting/?id=106914
42622,06/15/1963 03:00,Milford,CT,USA,Other,A solid black cylinder shape moving across the ground then rising like a shadow,03/01/2005,N,,https://nuforc.org/sighting/?id=42622
36206,06/15/1963 01:00,Hollywood,FL,USA,Disk,"UFO landing in Hollywood, FL 1963",04/10/2004,N,,https://nuforc.org/sighting/?id=36206
176366,06/12/1963 13:30,Muskegon,MI,USA,Disk,"Was hovering over field with no sound, 2 fighter jets approached; 1 jet evaporated; 2nd jet turned around and took off; UFO took off.",06/20/2023,N,,https://nuforc.org/sighting/?id=176366
97065,06/11/1963 11:00,Menasha,WI,USA,Circle,Bell shaped craft watched us play kick ball.,04/10/2013,N,,https://nuforc.org/sighting/?id=97065
16772,06/10/1963 03:00,Fort Collins,CO,USA,Cigar,A bright object followed the deputy sheriff's patrol boat for approximately seven miles.,03/10/2001,N,,https://nuforc.org/sighting/?id=16772
36915,06/06/1963 16:00,Calgary (east of) (Canada),AB,Canada,Cigar,I noticed a long silvery cigar shaped object,05/13/2004,N,,https://nuforc.org/sighting/?id=36915
38299,06/01/1963 23:00,Colorado Springs (mtns. NW of),CO,USA,Disk,UFO hovered and made right angle turns before shooting off at an incredible rate of speed when approached by a jet.,07/25/2004,N,,https://nuforc.org/sighting/?id=38299
64253,06/01/1963 22:00,Big Kandiyohi Lake,MN,USA,Light,Two bright white lights that stopped in midair and disappeared over the horizon within seconds,07/02/2008,N,,https://nuforc.org/sighting/?id=64253
70598,06/01/1963 21:00,Rodeo,CA,USA,Sphere,Blue humming and vibrating sphere in my room,06/20/2009,N,,https://nuforc.org/sighting/?id=70598
2342,06/01/1963 20:00,Laguna Beach (south),CA,USA,Light,USO(s) - Unidentified Submerged Object(s) -- yeh! I know guys! You probably only care about lights in the sky! But hey I'm not the only,07/05/1997,N,,https://nuforc.org/sighting/?id=2342
56827,06/01/1963 18:00,Royal Oak,MI,USA,Triangle,"A hovering triangular craft, with moving white lights on the sides and a red light on the bottom.",05/27/2007,N,,https://nuforc.org/sighting/?id=56827
37371,06/01/1963 16:00,Waukegan,IL,USA,Formation,Group of stationary objects high in afternoon sky with new objects entering group and some leaving,06/05/2004,N,,https://nuforc.org/sighting/?id=37371
61142,06/01/1963 13:00,Kirksey,KY,USA,Triangle,Triangle shaped UFO seen in daytime in 1963 in rural West Kentucky community,01/23/2008,N,,https://nuforc.org/sighting/?id=61142
59244,06/01/1963 12:00,Houston,TX,USA,Cigar,"Cigar shaped UFO over north Houston,,  before the building of IAH.",10/13/2007,N,,https://nuforc.org/sighting/?id=59244
179860,06/01/1963 12:00,Santa Cruz,CA,USA,Circle,Close view of UFO during daylight hours,12/30/2023,N,,https://nuforc.org/sighting/?id=179860
2250,06/01/1963 11:00,Albemarle,NC,USA,Disk,"outside playling ,neighbor starting yelling pointing up to the sky , went over to look the woman was scared she ran into her house told",06/01/1997,N,,https://nuforc.org/sighting/?id=2250
18620,06/01/1963 08:30,Gonzales,TX,USA,Cigar,"Object was cigar shaped,lights along side and exremely fast.",07/25/2001,N,,https://nuforc.org/sighting/?id=18620
65703,06/01/1963 08:00,Williamsport,MD,USA,Other,one evening in the early fall a huge red glowing but soft fireball came down right beside me staying with me  maybe 5 or 10 minutes,09/16/2008,N,,https://nuforc.org/sighting/?id=65703
57254,06/01/1963 02:00,St. Louis County,MO,USA,Cigar,"Cigar shaped craft hovering over swimming pool, March 1963, 02:00-03:00, slits along edge of hull of craft",06/23/2007,N,,https://nuforc.org/sighting/?id=57254
53865,06/01/1963 00:00,Cocoa,FL,USA,Unknown,"We are not alone,  I swear it before God Almighty.",12/07/2006,N,,https://nuforc.org/sighting/?id=53865
62155,06/01/1963 00:00,Houston,TX,USA,Unknown,((HOAX??))  Event.,03/12/2008,N,,https://nuforc.org/sighting/?id=62155
57316,06/01/1963 00:00,San Francisco,CA,USA,Disk,"San Francisco man, then 22, reported details of 1963 abduction to friend.

 500 Lights On Object0: Yes",06/25/2007,N,,https://nuforc.org/sighting/?id=57316
81075,05/30/1963 17:30,Emporia,KS,USA,Rectangle,"I have witnessed  many bizarre things in my life beginning at age 4.5,  this is not the strangest.  Try India.",05/01/2011,N,,https://nuforc.org/sighting/?id=81075
96558,05/15/1963 22:00,Tishimingo,OK,USA,Changing,Many campers saw maneuvering lights for hours in southern Oklahoma.,03/07/2013,N,,https://nuforc.org/sighting/?id=96558
27023,05/15/1963 14:00,Towson,MD,USA,Oval,"Bright, rapidly moving object moving from east to west that reflected the sun as it made a slight turn to the Southwest.",01/10/2003,N,,https://nuforc.org/sighting/?id=27023
59752,05/15/1963 07:00,New York City (Brooklyn),NY,USA,Other,"SILENT, SUSPENDED WATER TOWER APPEARS OVER HOUSES IN SEA GATE, BROOKLYN, NEW YORK",11/11/2007,N,,https://nuforc.org/sighting/?id=59752
33958,05/07/1963 03:00,Lynn,MA,USA,Disk,"05/07/1965; @3:00am lynn,ma essex county usa; two abductees, 8 witnesses; two sauces, 1 burnt field",12/20/2003,N,,https://nuforc.org/sighting/?id=33958
141908,05/04/1963 22:00,Goodwin,SD,USA,Light,A bright light with a buzzing noise stops our car on rural highway.,06/21/2018,N,,https://nuforc.org/sighting/?id=141908
141982,05/04/1963 21:00,Hazel,SD,USA,Unknown,Corrected version of previous submission which I had sublitted about two hours prior to this one... (I had the direction of flight path,06/29/2018,N,,https://nuforc.org/sighting/?id=141982
141980,05/01/1963 21:00,Hazel,SD,USA,Unknown,"Corroboration of 1963 sighting in Goodwin, SD.",06/29/2018,N,,https://nuforc.org/sighting/?id=141980
163881,05/01/1963 20:00,Jackson,OH,USA,Circle,"Oval shaped disc hovering over our neighborhood for several minutes, seen by many in the neighborhood in May 1963",06/30/2021,N,,https://nuforc.org/sighting/?id=163881
120664,05/01/1963 20:00,Honolulu,NC,USA,Disk,Mass sighting in Honolulu during early '60's.,07/26/2015,N,,https://nuforc.org/sighting/?id=120664
57393,04/20/1963 17:00,Alexandria,VA,USA,Light,"4 red lights flying near Mt. Vernon, Va. toward Potomac River, in early evening April 1963 or 1964",07/01/2007,N,,https://nuforc.org/sighting/?id=57393
4908,04/15/1963 19:30,Lompoc/Vandenberg AFB,CA,USA,Disk,FLYING DISC OBSERVED OVER MOUNTAIN DURING LAUNCH OF SCOUT MISSILE,11/25/1998,N,,https://nuforc.org/sighting/?id=4908
62759,04/10/1963 00:00,Russellton,PA,USA,Sphere,UFO was seen back in the 1963 near Russellton PA,04/16/2008,N,,https://nuforc.org/sighting/?id=62759
84899,04/07/1963 20:00,Vero Beach,FL,USA,Disk,"Vero Beach Fla, 1960's; low, huge hovering disk over highway shooting colored lights out the back  with illuminated windows.",10/26/2011,N,,https://nuforc.org/sighting/?id=84899
8381,04/01/1963 07:00,Tucson,AZ,USA,Triangle,Observed in western sky @ about 100 ft. flying to the south at about 10 to25 mph Flying in formation as geese would fly,07/17/1999,N,,https://nuforc.org/sighting/?id=8381
42979,03/29/1963 20:00,Clunes/Maryborough (near) (Australia),,Australia,Disk,Same event witnessed in Clunes Australia and Clunies in France ((NUFORC Note:  More information requested of witness.  PD)),03/15/2005,N,,https://nuforc.org/sighting/?id=42979
17476,03/15/1963 17:30,Great Lakes,IL,USA,Disk,Craft of some size flew slowly over the Great Lakes Naval base during my tenure at boot camp.,04/30/2001,N,,https://nuforc.org/sighting/?id=17476
87837,03/15/1963 13:00,Normandy Park,WA,USA,Cylinder,Pencil-like objects seen flying over the water.,03/19/2012,N,,https://nuforc.org/sighting/?id=87837
159266,03/12/1963 20:00,Laurel,MS,USA,Disk,"In the spring of 1963 I had just turned fifteen years old and had gotten my driver's liscense.

A friend of mine and I had a double d",09/07/2020,N,,https://nuforc.org/sighting/?id=159266
54721,02/23/1963 11:30,Husten,TX,USA,,Why?,01/13/2007,N,,https://nuforc.org/sighting/?id=54721
36119,02/21/1963 21:30,Cape May Court House,NJ,USA,Unknown,This incident happened in the early 60's and I still remember it like it happened yesterday. It scared the crap out of me!!!,04/10/2004,N,,https://nuforc.org/sighting/?id=36119
41954,01/20/1963 22:00,Holyoke,MA,USA,Disk,6 massive ufo's parked on moon. old sighting,02/14/2005,N,,https://nuforc.org/sighting/?id=41954
166332,01/10/1963 09:15,"Tambaram, Chennai (India)",Tamil Nadu,India,Sphere,Orb strike against my grandmothers head,01/20/2022,N,,https://nuforc.org/sighting/?id=166332
87117,01/01/1963 22:00,Helena (near),MT,USA,Diamond,Diamond shaped UFO blocks USAF runway,02/09/2012,N,,https://nuforc.org/sighting/?id=87117
16102,01/01/1963 10:00,Markleville (Alpine County),CA,USA,Disk,In 1963 an Elementary School in Alpine County California witnesses a flying saucer at 40 feet.,01/30/2001,N,,https://nuforc.org/sighting/?id=16102
47141,12/21/1962 23:21,New York City,NY,USA,Cigar,"the ufo I saw on dec, 21, 1962  in NYC has never appeared on any website I could find",10/21/2005,N,,https://nuforc.org/sighting/?id=47141
58347,12/05/1962 00:00,Pacific Ocean (in flight),,Pacific Ocean,,,08/23/2007,N,,https://nuforc.org/sighting/?id=58347
63321,11/15/1962 23:00,Cardiff (UK/Wales),,United Kingdom,Disk,This happened in november 1962. It was a large round saucer with revolving lights in the middle.,05/20/2008,N,,https://nuforc.org/sighting/?id=63321
58574,11/15/1962 21:00,Runge,TX,USA,Sphere,creature in transparent sphere  panics at being seen by nine year old boy,09/04/2007,N,,https://nuforc.org/sighting/?id=58574
11176,11/15/1962 14:00,Alameda Naval Air Station/Marine Corp Air Wing Bubble,CA,USA,,Ufo Collision with Marine Corp Fighter,11/26/1999,N,,https://nuforc.org/sighting/?id=11176
42310,11/09/1962 20:30,Pharr,TX,USA,Chevron,V shaped glowing object splits up into six similar objects and quickly disperse.,02/24/2005,N,,https://nuforc.org/sighting/?id=42310
31989,11/01/1962 18:00,Valparaiso,FL,USA,Cigar,"orange, glowing cigar over bayou",10/01/2003,N,,https://nuforc.org/sighting/?id=31989
81622,10/20/1962 05:30,Ramey Airforce Base (SAC) (Puerto Rico),PR,USA,Oval,Strange cloud seen at Airforce Base near the Carribean Sea,06/01/2011,N,,https://nuforc.org/sighting/?id=81622
18680,10/15/1962 22:30,Chicago,IL,USA,Other,SITTING IN AVALON PARK ON A FALL NIGHT AT APP.1030 PM I SAW A METALIC OBJECT TRAVELING FROM E TO W I DIDNT GIVE IT MUCH THOUGHT BUT IT ,07/27/2001,N,,https://nuforc.org/sighting/?id=18680
84526,10/15/1962 00:00,Ft. Lee,VA,USA,,"USAF detection and interception attempt of UFO detected by radar at 70,000' altitude.",10/14/2011,N,,https://nuforc.org/sighting/?id=84526
103390,09/29/1962 22:00,Savannah (Hunter AFB),GA,USA,Oval,"Hunter AFB, Savannah Georgia 1962-1963: Luminous zig-zag disk",10/19/2013,N,,https://nuforc.org/sighting/?id=103390
16422,09/15/1962 18:00,Island Beach State Park,NJ,USA,Disk,I saw 3 saucers flying out over the ocean during daylight.  They did not spin or make a sound and I will never forget it!,02/11/2001,N,,https://nuforc.org/sighting/?id=16422
93085,09/15/1962 14:00,Severn (Northhampton) (UK/England),NC,United Kingdom,Unknown,"Car electrical system failed, then recovered",09/26/2012,N,,https://nuforc.org/sighting/?id=93085
67756,09/15/1962 07:00,Puerto Rico,PR,USA,Disk,Spinning lights inside of a small boiling cloud.,12/31/2008,N,,https://nuforc.org/sighting/?id=67756
6156,09/14/1962 17:30,Wisconsin (rural),WI,USA,Disk,we were walking home after a day of hunting and an orange light came from nowere and shined down on us. it followed us and we shot at i,04/12/1999,N,,https://nuforc.org/sighting/?id=6156
183361,09/09/1962 20:33,Phenix City,AL,USA,Circle,It was not a star.,10/07/2024,N,,https://nuforc.org/sighting/?id=183361
49863,09/04/1962 15:30,St. Louis,MO,USA,Sphere,Observation of spherical white colored craft in geostationary position for 1 hour plus.,03/29/2006,N,,https://nuforc.org/sighting/?id=49863
84909,09/01/1962 15:00,Hopewell,VA,USA,Light,Fast high altitude sunlit object made sharp 90 degree turn before going out of sight.,10/26/2011,N,,https://nuforc.org/sighting/?id=84909
