report_id,occurred_on,city,state,country,shape,summary,reported_on,has_media,explanation,report_link
76629,10/15/1955 20:00,Rhinebeck,NY,USA,Light,"This very distant star-like point of light came very slowly up over the treeline from the Southwest, stopped.",07/18/2010,N,,https://nuforc.org/sighting/?id=76629
60217,10/10/1955 17:00,Chester (UK/England),,United Kingdom,Circle,"Green/Orange circular disc over Chester, England",12/06/2007,N,,https://nuforc.org/sighting/?id=60217
34506,10/09/1955 18:00,West Covina,CA,USA,,Brilliant green meteor heading north west from view in California near L.A.,01/17/2004,N,,https://nuforc.org/sighting/?id=34506
176729,10/07/1955 21:30,Near McCamey,TX,USA,Light,A bright star like overhead in the dark sky.,07/12/2023,N,,https://nuforc.org/sighting/?id=176729
171659,10/05/1955 16:00,Great Falls,MT,USA,Disk,My father told me of a incident that happened while he was stationed in Great Falls Montana in the Air Force .,09/09/2022,N,,https://nuforc.org/sighting/?id=171659
43284,10/03/1955 06:00,Stanley (near) (Canada),NB,Canada,Disk,This is a true story as given to me,04/01/2005,N,,https://nuforc.org/sighting/?id=43284
68193,10/01/1955 22:00,Mono Lake (area),CA,USA,Circle,"NO KNOWN AIRCRAFT (1955 and maybe today) COULD MAKE SUCH A SPEEDY 360 DEGREE CIRCLE MANUVER, WITH NO SOUND !",01/22/2009,N,,https://nuforc.org/sighting/?id=68193
147106,09/17/1955 12:00,Fountain Inn,SC,USA,Disk,Silver disk or saucer hovering over Park Road.,06/27/2019,N,,https://nuforc.org/sighting/?id=147106
32315,09/10/1955 23:00,Bullhead (Davis Camp),AZ,USA,Disk,ufo getting power from dam,10/18/2003,N,,https://nuforc.org/sighting/?id=32315
39529,08/17/1955 21:00,Covina,CA,USA,Disk,It was about 1500 ft up. It just stayed there in one spot for 10 mins then was gone.,09/28/2004,N,,https://nuforc.org/sighting/?id=39529
32327,08/15/1955 14:00,Woodland Park,CO,USA,Oval,Orange disk in night sky,10/18/2003,N,,https://nuforc.org/sighting/?id=32327
14811,08/15/1955 00:01,Eagle Pass,TX,USA,Cigar,Mr. Martin in 1955 has encounter with cigar shaped object in 1955,11/04/2000,N,,https://nuforc.org/sighting/?id=14811
32653,08/14/1955 01:00,Madisonville,KY,USA,Light,traveled 50 miles with no driver after being the light,10/25/2003,N,,https://nuforc.org/sighting/?id=32653
50478,08/08/1955 01:00,Independence,MO,USA,Fireball,Flaming ball of light making right angle turns seen from front porch on a hot summer's night.,05/08/2006,N,,https://nuforc.org/sighting/?id=50478
85718,08/06/1955 19:00,Newtown Square,PA,USA,Circle,A round object going from bottom to top of moon in 4 seconds,12/06/2011,N,,https://nuforc.org/sighting/?id=85718
52404,07/15/1955 22:00,Ringold,LA,USA,Light,As a young boy at church summer camp my friend and I were sitting on the steps of the main dining hall talking. I looked up in the sky,09/08/2006,N,,https://nuforc.org/sighting/?id=52404
33977,07/15/1955 19:00,Yokota A.F.B.,,Japan,Light,Missing time,12/20/2003,N,,https://nuforc.org/sighting/?id=33977
158376,07/10/1955 12:00,Sproul,PA,USA,Circle,On or about 7/10/1955 I observed a circular gray object on a cloudy day in the sky for a few seconds as the object moved between clouds,08/10/2020,N,,https://nuforc.org/sighting/?id=158376
54261,07/07/1955 14:00,UK/England (rural),,United Kingdom,Disk,"1955+/-, multiple identical circular saucers in formation, spinning, slow-moving, low,  30' dia.?, visual only.",01/01/2007,N,,https://nuforc.org/sighting/?id=54261
42575,07/01/1955 22:00,Dierks,AR,USA,Cigar,"Cigar-shaped craft, 8 feet long with flashing liglhts, hovering above ground",02/28/2005,N,,https://nuforc.org/sighting/?id=42575
5943,07/01/1955 21:00,Stoneville,NC,USA,Sphere,"a sphere of light,baseball at arms leingth.",03/15/1999,N,,https://nuforc.org/sighting/?id=5943
12521,07/01/1955 14:00,"Carnation (on Tolt River, Cascade Mts.)",WA,USA,Disk,1955 daytime sighting of a saucer craft by a family of four while on a picnic on a Sunday in the Cascade Mts. of Washington.  The famil,04/02/2000,N,,https://nuforc.org/sighting/?id=12521
27999,06/30/1955 21:00,?????,AK,USA,Fireball,"A bright light and a huge bang, then we saw it hovering for 13 minutes and it dissapired.",03/05/2003,N,,https://nuforc.org/sighting/?id=27999
108422,06/30/1955 21:00,Morehead City,NC,USA,Disk,"Mid 1950's Saucer in North Carolina, Multiple Witnesses.",04/07/2014,N,,https://nuforc.org/sighting/?id=108422
42894,06/30/1955 21:00,Dumas,TX,USA,Light,1955 - Air Force jets pursue lights over small Texas community.,03/12/2005,N,,https://nuforc.org/sighting/?id=42894
154866,06/30/1955 20:00,Sedgwick,AR,USA,Light,My brother saw a crisp clear light,04/07/2020,N,,https://nuforc.org/sighting/?id=154866
59458,06/30/1955 13:00,Lubbock,TX,USA,Cigar,Cigar shaped cloud and left very fast.,10/26/2007,N,,https://nuforc.org/sighting/?id=59458
64053,06/30/1955 00:00,Quartz Hill,CA,USA,Disk,childhood ufo,06/22/2008,N,,https://nuforc.org/sighting/?id=64053
4473,06/23/1955 07:00,Beach Haven Park,NJ,USA,Disk,"3 women hanging clothes saw a UFO come down over bay, hover for 30 sec.,then take off so fast it seemed to disappear.",07/17/1998,N,,https://nuforc.org/sighting/?id=4473
17799,06/17/1955 07:00,Rantoul,IL,USA,Light,We had fallen out to the parking lot awaiting marching orders to go to (chow) it was still dark and we saw a light approaching from the,05/26/2001,N,,https://nuforc.org/sighting/?id=17799
42144,06/15/1955 21:00,Daytona Beach,FL,USA,Fireball,"Three fireballs moved slowly along the beach, then suddenly accelerated and flew straight up into the night sky and disappeared.",02/24/2005,N,,https://nuforc.org/sighting/?id=42144
42579,06/15/1955 08:00,Youngstown,PA,USA,,In Retrospect...I definately saw a UFO!,02/28/2005,N,,https://nuforc.org/sighting/?id=42579
151534,06/15/1955 05:00,Grand Rapids,MI,USA,,I believe that I had an alien visitation while in the crib about 65 years ago.,12/12/2019,N,,https://nuforc.org/sighting/?id=151534
27397,06/15/1955 04:30,Missouri (northwest part),MO,USA,Light,I will never forget this this experience. The light is burnt into my memory liked it happened only this morning. I am now 54 years old.,01/30/2003,N,,https://nuforc.org/sighting/?id=27397
78989,06/15/1955 00:00,South St. Paul,MN,USA,Disk,"Peter: you""ll have to call me for the whole story. it will take too long to write it down. I do not know that muc",11/20/2010,N,,https://nuforc.org/sighting/?id=78989
39573,06/15/1955 00:00,Terre Haute,IN,USA,Circle,In the mid 1950's I saw this circular shaped object in the northern sky. It was orange in color and very large. One could associate it,10/01/2004,N,,https://nuforc.org/sighting/?id=39573
73193,06/06/1955 01:00,Pensacola,FL,USA,Light,orange fireball .,11/08/2009,N,,https://nuforc.org/sighting/?id=73193
22321,06/01/1955 20:30,Clinton,TN,USA,Egg,"Egg shaped craft landed on lonly country road, seen by a family of five.",03/24/2002,N,,https://nuforc.org/sighting/?id=22321
11838,06/01/1955 17:00,Martinez (outskirts),CA,USA,Circle,"We observed a large object aprox.size ""football field or larger"" aproach us 45mph make 90 degree turn. color ""red glowing ember"".2000 f",02/01/2000,N,,https://nuforc.org/sighting/?id=11838
29189,06/01/1955 15:29,Cincinnati,OH,USA,Disk,"June 1955.  Bronze saucer/cylindrical craft; approx. 3:30 p.m., no life form sited.",06/14/2003,N,,https://nuforc.org/sighting/?id=29189
7778,06/01/1955 02:00,Bagley,MN,USA,Circle,"I was 5 years old at the time, family of 4 told they would remember nothing. I managed to break free of the (mind) control just before ",05/16/1999,N,,https://nuforc.org/sighting/?id=7778
11790,06/01/1955 00:00,Homaland,CA,USA,Circle,"My grandfather saw it crash, in foot hills behind house.  Saw it on ground, airforce picked it up.  I saw crash site.  some time in 50s",01/24/2000,N,,https://nuforc.org/sighting/?id=11790
8249,06/01/1955 00:00,,,Unspecified,Disk,Only sighted momemtarily for an instant - next recollection is of waking up hours later.,07/04/1999,N,,https://nuforc.org/sighting/?id=8249
65946,06/01/1955 00:00,"Washington, D.C.",DC,USA,Formation,"Two fighter airplanes, assigned to inspect a white-dot cluster, suddenly disappear off radar, and then the cluster also disappears.",09/28/2008,N,,https://nuforc.org/sighting/?id=65946
54728,05/15/1955 03:00,Warrington,FL,USA,Fireball,fireball into pensacola bay,01/14/2007,N,,https://nuforc.org/sighting/?id=54728
153603,05/11/1955 19:34,Auckland (New Zealand),,New Zealand,Disk,Unidentifiable image in my photo taken while in NZ.  ((NUFORC Note:  Lens flare.  PD))((Anonymous report)),02/25/2020,N,,https://nuforc.org/sighting/?id=153603
43164,05/01/1955 15:00,Holbrook,MA,USA,Egg,I turned around and over the trees was a large yellow object shaped like a football without the tips on the ends.,03/24/2005,N,,https://nuforc.org/sighting/?id=43164
117314,03/01/1955 17:00,Santa Rosa,CA,USA,Disk,Large 200' plus  disk shaped object observed over Santa Rosa in 1955. News Paper account missing.,02/14/2015,N,,https://nuforc.org/sighting/?id=117314
74380,02/15/1955 21:55,Welwyn Garden City (UK/England),,United Kingdom,Fireball,2 orange lights like fireball stayed together quit low for 10 mins then one shot off so fast i could not beleive it,02/14/2010,N,,https://nuforc.org/sighting/?id=74380
66748,02/15/1955 19:00,New York City (Brooklyn),NY,USA,Light,TWO BRIGHT STAR SHAPE OBJECTS AT 700PM GOING FROM SOUTH SKI TO THE NORTH AT HIGH  SPEEDS NO SOUND,11/06/2008,N,,https://nuforc.org/sighting/?id=66748
153015,01/31/1955 07:00,Shawnee,OK,USA,Light,"The Oklahoma infinite vanishing star train.  ((:Starlink"" satellites??))",02/02/2020,N,,https://nuforc.org/sighting/?id=153015
125578,01/27/1955 13:30,Odessa,TX,USA,Other,Apache heli flying 300-500 feet above ground seemed to be following something,02/01/2016,N,,https://nuforc.org/sighting/?id=125578
59969,12/16/1954 16:50,Yucaipa,CA,USA,Oval,"Luminous oval over Yucaipa, similar object reported by L.A. newspapers over Inyokern Air Base",11/20/2007,N,,https://nuforc.org/sighting/?id=59969
13818,12/15/1954 23:10,Red Bank,NJ,USA,Circle,"Bright orange light, about the size of a pea at arms length, moving slowly from the west to NE.  I was a soldier, stationed at Ft. Monm",08/17/2000,N,,https://nuforc.org/sighting/?id=13818
45718,11/14/1954 01:00,Thelma (south of),TX,USA,Disk,"11/14/1954   WHILE HUNTING OBJECT CIRCLED, LANDED AND THEN TOOK OFF STRAIGHT OUT OF SIGHT.",08/21/2005,N,,https://nuforc.org/sighting/?id=45718
154822,11/12/1954 13:30,Dona Ana,NM,USA,Cigar,"Saw this in 1954 at the Dona Ana Army rifle range in New Mexico. When the separation of targets from the shooter is large, at each targ",04/05/2020,N,,https://nuforc.org/sighting/?id=154822
17869,11/01/1954 18:30,Denver,CO,USA,Fireball,I was approximately 12 years old when I saw this UFO.  I haven't told a lot of people about it.  I thought because I was so young at th,05/31/2001,N,,https://nuforc.org/sighting/?id=17869
60814,10/15/1954 21:30,Manistee,MI,USA,Circle,"Saucer shaped, moved north to south directly above the street, no sound, moon was to the east",01/14/2008,N,,https://nuforc.org/sighting/?id=60814
36244,10/15/1954 16:30,Blanco,TX,USA,Other,"We saw a silver football, motionless in the sky; stopped , looked about 3-5 mins. and resumed the trip.",04/11/2004,N,,https://nuforc.org/sighting/?id=36244
96518,10/01/1954 19:00,Flatwoods,WV,USA,Circle,"I saw the craft go across the horizon.  It appeared to be on fire, I first thought it was a plane going down.  It landed near a farm.",03/04/2013,N,,https://nuforc.org/sighting/?id=96518
59814,09/15/1954 09:30,Palmer Township,PA,USA,Other,Saturn-shaped object appearing over the Pennsylvania night sky in the fall of 1954,11/13/2007,N,,https://nuforc.org/sighting/?id=59814
34019,09/09/1954 12:30,Beaumont,TX,USA,Disk,Aprox. 30 Disk shaped UFOs fell out of clouds got in V formatin  and shot toward a black rain cloud avoiding a Jet Plane.,12/20/2003,N,,https://nuforc.org/sighting/?id=34019
32218,09/01/1954 13:00,Geneva,NY,USA,Disk,"While marching on a bivouac maneuver in (?) September 1954, I caught a glimpse overhead of a disc-shaped, metallic in color object that",10/14/2003,N,,https://nuforc.org/sighting/?id=32218
185034,09/01/1954 01:00,Philadelphia,PA,USA,Orb,"There was a visit which terrified me, and a few nights later an incident similar to the April 1561 broadsheet account",12/12/2024,Y,,https://nuforc.org/sighting/?id=185034
92985,08/26/1954 16:00,Ferndown-Bournemouth (UK/Wales),,United Kingdom,Disk,U F O Hovering over Ferndown in Bournemouth 1954 England,09/22/2012,N,,https://nuforc.org/sighting/?id=92985
77763,08/24/1954 05:00,Parent (Canada),QC,Canada,Other,Capsule shaped copper coloured object hung motionless over the domestic site for approximately three or four minutes,09/11/2010,N,,https://nuforc.org/sighting/?id=77763
42503,08/15/1954 21:00,Puyallup,WA,USA,Oval,The object was hovering above the treetops over the road a short distance in front of my car...,02/26/2005,N,,https://nuforc.org/sighting/?id=42503
160870,08/15/1954 20:30,Indianapolis,IN,USA,,It appeared to be a fast moving white cloud in level flight,11/28/2020,N,,https://nuforc.org/sighting/?id=160870
86828,08/01/1954 22:00,North Hollywood,CA,USA,Light,Star like point of light slowly travelling across the sky in 1954,01/25/2012,N,,https://nuforc.org/sighting/?id=86828
42408,08/01/1954 21:00,Canton,PA,USA,Disk,"Large, silver-blue disc shaped oject which gave off high pitched sound and was slowly turning on its axis and then suddenly sped away.",02/25/2005,N,,https://nuforc.org/sighting/?id=42408
37042,08/01/1954 17:00,Dyer,IN,USA,Triangle,I saw a silent exhaustless golden glowing slow flying triangle on a late summer afternoon In 1954 or 1955.,05/19/2004,N,,https://nuforc.org/sighting/?id=37042
31696,08/01/1954 12:00,Farmingdale,NY,USA,Oval,"Sphere  -30 min. - Stationary, bright object over Jet Factory  -1954",09/21/2003,N,,https://nuforc.org/sighting/?id=31696
180020,07/17/1954 15:00,Compton,CA,USA,Disk,"This sighting was filmed with a 8mm by one of the little league coach, with me in the foreground.",01/13/2024,N,,https://nuforc.org/sighting/?id=180020
22958,07/15/1954 22:00,New Toronto (Canada),ON,Canada,Circle,it was a white round object which was the same sizes as the full moon,05/22/2002,N,,https://nuforc.org/sighting/?id=22958
28881,07/15/1954 22:00,Bridge Hampton,NY,USA,Light,High speed object zig-zagging down at a 170 Degree angle - Brookhaven direction,05/21/2003,N,,https://nuforc.org/sighting/?id=28881
24522,07/15/1954 21:00,Oakdale,NY,USA,Disk,"Three highly luminesce objects in a ""V"" formation gliding through the black night sky.",08/18/2002,N,,https://nuforc.org/sighting/?id=24522
63690,07/15/1954 21:00,Kansas City,KS,USA,Chevron,MISSOURI INVESTIGATORS GROUP Report:  Two brothers witness chevron-shaped object streak across sky.  PD)),06/03/2008,N,,https://nuforc.org/sighting/?id=63690
24246,07/15/1954 14:00,"Greenfield (Rural area, 6 miles so.)",IN,USA,Cigar,"This all occured when I was still a child and living on a farm. My mother, our next door neigbor's wife, and myself, were standing outs",08/07/2002,N,,https://nuforc.org/sighting/?id=24246
42333,07/15/1954 11:00,Philadelphia,PA,USA,Disk,"I saw 2 alabaster white perfectly round objects over our ball field as they hovered over us for about an hour ,then they were gone.",02/25/2005,N,,https://nuforc.org/sighting/?id=42333
45591,07/15/1954 00:00,Korea (over 38th Parallel),,Korea,Disk,One Week Visit by Huge Saucer  over Korea,08/12/2005,N,,https://nuforc.org/sighting/?id=45591
26962,07/12/1954 17:30,Morroco (4 miles south of),IN,USA,Changing,"I WAS 12, RIDING WITH AN UNCLE AUNT AND GRANDMOTHER ON US 41 MY UNCLE EXITEDLEY STATED PLANE WAS CRASHING TO THE GROUND.A FLAMING OBJEC",01/08/2003,N,,https://nuforc.org/sighting/?id=26962
27608,07/07/1954 22:00,West Columbia,SC,USA,Formation,"3circles together, very bright lighting around them and on them, silver, like 3 wedding rings together",02/09/2003,N,,https://nuforc.org/sighting/?id=27608
39524,07/07/1954 20:00,Walnut Creek,CA,USA,Unknown,I have not reported this before. I feel it should be recorderd somewhere. My friend and I used to take time-lapse photos of the stars a,09/28/2004,N,,https://nuforc.org/sighting/?id=39524
96081,07/01/1954 22:00,Los Angeles,CA,USA,Circle,"In 1954, I saw a red glowing disc traveling thousands of mph straight over the Los Angeles night sky.",01/24/2013,N,,https://nuforc.org/sighting/?id=96081
8793,07/01/1954 21:00,St. Louis Airport (Lambert Field),MO,USA,Oval,"EXTREMELY bright, red oval near airport.  Object suddenly accelerates and STREAKS over horizon.",08/23/1999,N,,https://nuforc.org/sighting/?id=8793
106855,06/30/1954 23:00,UK/England,,United Kingdom,Fireball,"B-17 Pilot Report:  Fiery orb tracks USAF bomber on night mission; returns 30 minutes later, dumbfounding pilots.",02/01/2014,N,,https://nuforc.org/sighting/?id=106855
69531,06/30/1954 15:00,Pasadena,CA,USA,Circle,"An incandescent white circular object passed over Pasadena, CA and ejected a smaller version of itself.",04/04/2009,N,,https://nuforc.org/sighting/?id=69531
145915,06/30/1954 12:30,Detroit,MI,USA,Unknown,"My aunt grew up in Detroit near Ford Road and Evergreen, on Minock St. About 1954 or 1955 One day when she was 12 years old her and a f",04/28/2019,N,,https://nuforc.org/sighting/?id=145915
51927,06/30/1954 12:00,Hawthorne,CA,USA,Light,"Stationary light for several minutes (far away), takiing off suddenly at great speed.",08/04/2006,N,,https://nuforc.org/sighting/?id=51927
52147,06/30/1954 00:00,Marion,VA,USA,Circle,"This was a story told to me by my mother , that a circular object appeared on top of the radio transmission antenna tower in the area a",08/24/2006,N,,https://nuforc.org/sighting/?id=52147
84986,06/30/1954 00:00,Methuen,MA,USA,,A small light in the distance changes direction and appears to come closer.,10/29/2011,N,,https://nuforc.org/sighting/?id=84986
107932,06/25/1954 03:30,Thrifty,TX,USA,Circle,"6-25-1954, Red circle of light in Thrifty, Texas.  USA.",03/18/2014,N,,https://nuforc.org/sighting/?id=107932
12240,06/23/1954 23:00,Langley Air Force Base,VA,USA,Circle,Object appearing larger than a full moon hovering over hangers moved at varying speeds and made 90 and 180-degree turns.,03/11/2000,N,,https://nuforc.org/sighting/?id=12240
32860,06/23/1954 02:00,Lorton,VA,USA,Other,My Mother heard what she believed was a UFO.,11/04/2003,N,,https://nuforc.org/sighting/?id=32860
133210,06/15/1954 19:00,Orchard Park,NY,USA,Disk,Observed small gray disk.,03/19/2017,N,,https://nuforc.org/sighting/?id=133210
48903,06/15/1954 16:30,Ellington AFB,TX,USA,Disk,Radar site-200mi range @Ellington AFB-Radar op observed an unidentified object  coming in from NW at a high rate of speed-Abt 8 of us w,01/28/2006,N,,https://nuforc.org/sighting/?id=48903
32922,06/15/1954 11:45,Claymont,DE,USA,Disk,"It was just before noon on a warm sunny  June day, I was 16 yrs old. Riding in the car with my brother-inlaw driving, my sister riding",11/07/2003,N,,https://nuforc.org/sighting/?id=32922
37112,06/15/1954 11:00,Palm Beach,CA,USA,Light,The objects were high in the sky and brightly lit resembling light bulbs.,05/23/2004,N,,https://nuforc.org/sighting/?id=37112
38306,06/15/1954 00:00,Korean Peninsula,,Korea,Rectangle,USMC radar operator witnesses 3 blips on radar scope.,07/25/2004,N,,https://nuforc.org/sighting/?id=38306
34363,06/11/1954 02:00,Glenburn,ME,USA,Unknown,A FLASH OF METALIC LIGHT REFLECTING OF A OBJECT MOVING AT MY GUESS AT 3-4 000MPH,01/08/2004,N,,https://nuforc.org/sighting/?id=34363
63869,06/10/1954 20:00,Estes Park,CO,USA,Cigar,"1953  Estes Park, Colorado  cigar shaped craft floating above pine trees on a ranch",06/13/2008,N,,https://nuforc.org/sighting/?id=63869
21650,06/06/1954 10:00,Atlanta,GA,USA,Disk,"U.F.O spoted that had some bugs in it,  no not the X files,  but close!!",02/02/2002,N,,https://nuforc.org/sighting/?id=21650
2341,06/01/1954 23:00,Fish Canyon,CA,USA,Light,Helix flight pattern at zenith,07/05/1997,N,,https://nuforc.org/sighting/?id=2341
11118,06/01/1954 20:00,Norfolk/Nob,VA,USA,Disk,"bright white like full moon,s slightly tilted crossed over our ship from west to east not at high rate of speed  clear night  none of t",11/22/1999,N,,https://nuforc.org/sighting/?id=11118
15069,06/01/1954 20:00,Philadelphia,PA,USA,Disk,They Are Our Brothers,11/26/2000,N,,https://nuforc.org/sighting/?id=15069
18236,06/01/1954 19:00,Toledo,OH,USA,Disk,SEE ABOVE,06/29/2001,N,,https://nuforc.org/sighting/?id=18236
17550,06/01/1954 19:00,El Cerrito,CA,USA,Light,It was a Sunday evening and must have been in November of Decemberme to Berkeley because it was dark and I needed to be in Berkeley for,05/08/2001,N,,https://nuforc.org/sighting/?id=17550
12027,06/01/1954 08:00,Springfield (rural area near),IL,USA,Cylinder,"This happened many years ago when I was a child.  Object, 3' long, crystal type cylinder, pinkish color came in fast from the East and ",02/17/2000,N,,https://nuforc.org/sighting/?id=12027
20538,06/01/1954 06:00,Ovid,NY,USA,Disk,I saw two silver/gray objects of different shapes.,11/22/2001,N,,https://nuforc.org/sighting/?id=20538
127936,06/01/1954 03:00,Hawthorne,CA,USA,Other,"It was 1954.  Background.  I was 24, busy building our young family, had never heard of the 1947 Saucers by Mt. Rainier.",06/17/2016,N,,https://nuforc.org/sighting/?id=127936
11902,06/01/1954 00:00,Ramey Air Force Base (Puerto Rico),PR,USA,Circle,"Coming out of mess hall, I saw A circular, sharp edged, without other features object over the ocean, in line with the runway at a SAC",02/08/2000,N,,https://nuforc.org/sighting/?id=11902
63197,06/01/1954 00:00,Houston,TX,USA,Disk,I fulfilled my duty by passing on an unusual accourance,05/16/2008,N,,https://nuforc.org/sighting/?id=63197
72287,05/26/1954 04:30,Quincy (rural),IL,USA,Disk,"Saucer shaped object with lights and a dome seen near Quincy, Il.",09/14/2009,N,,https://nuforc.org/sighting/?id=72287
3265,05/15/1954 12:00,Corvallis (Near; small town of Alsea),OR,USA,Diamond,"Disc top, or bottom to our view following, west to east, a 4 engine (prop) maybe a Tri Star (three rudders) About 1/2 way across our vi",03/02/1998,N,,https://nuforc.org/sighting/?id=3265
18730,04/01/1954 22:00,Stanford Campus,CA,USA,Disk,Civil Defense plane spotter  reports UFO sighting at Stanford University,07/30/2001,N,,https://nuforc.org/sighting/?id=18730
108668,02/15/1954 19:30,Burney,CA,USA,Disk,Observance of one large and two smaller UFOs in a comparitive prolonged period of time.,04/15/2014,N,,https://nuforc.org/sighting/?id=108668
125790,02/10/1954 19:15,Freeport,NY,USA,Other,"Rocket-shaped object emitting sparks, making a sputtering noise and moving at 10-15 mph past the observer within 25' to 30'.",02/11/2016,N,,https://nuforc.org/sighting/?id=125790
67341,02/01/1954 02:00,Fairbanks,AK,USA,Unknown,RADAR INTERCEPT OF UFO BY USAF PILOT IN ALASKA 1954.,12/06/2008,N,,https://nuforc.org/sighting/?id=67341
32385,01/15/1954 20:00,Santa Monica,CT,USA,Light,"very bright light zig-zagging  fast across the sky, then zoomed straight up",10/18/2003,N,,https://nuforc.org/sighting/?id=32385
43491,01/01/1954 22:00,Sioux City,IA,USA,Circle,"1954 Radar sighting, Air Force base in Iowa - 50,000 - 80,000 feet 1,200-1,800 miles per hour.",04/15/2005,N,,https://nuforc.org/sighting/?id=43491
41192,01/01/1954 01:00,Lakeland,FL,USA,Disk,Unusual experience in Florida in 1954,12/20/2004,N,,https://nuforc.org/sighting/?id=41192
35386,01/01/1954 00:00,Brunswick,ME,USA,Unknown,This descripition is second hand from my father.  He was a radar operator at Brunswick Navy Air Station from 1954-58.  The guys that we,03/03/2004,N,,https://nuforc.org/sighting/?id=35386
12889,11/25/1953 04:25,Lackland Air Force Base near Aviation cadet barracks,TX,USA,Disk,When I was in preflight for pilot training at Lackland AFB just before Xmas we were standing in formation for reveille we all saw a sau,05/16/2000,N,,https://nuforc.org/sighting/?id=12889
32867,11/21/1953 22:30,Pendleton (2-2 1/2 mi. SE of),IN,USA,Disk,"On a moonless, star-lit night,  greenish-orange light moves rapidly and silently  about the dark sky while being pursued by a jet.",11/04/2003,N,,https://nuforc.org/sighting/?id=32867
18826,11/15/1953 03:00,Keansburg,NJ,USA,Circle,"In November, 1953, at 0300, a silvery sphere moves slowly overhead, changes direction, and disappears over the horizon.",08/04/2001,N,,https://nuforc.org/sighting/?id=18826
60282,11/13/1953 20:00,Cicero,IL,USA,Other,"Triangular formation passing over head just west of Chicago, Illinois.",12/10/2007,N,,https://nuforc.org/sighting/?id=60282
176170,11/01/1953 06:00,Hamilton,CA,USA,Other,Object or objects reviewed were not of earth,06/09/2023,N,,https://nuforc.org/sighting/?id=176170
45026,10/31/1953 19:00,New Orleans,LA,USA,Oval,20+ ovals flying over New Orleans,07/16/2005,N,,https://nuforc.org/sighting/?id=45026
25857,10/15/1953 14:00,Mauriceville,TX,USA,Disk,My father was a WWW1 Vet. and loved hunting. The year was round 1953.We lived in a town of 300 people in southeast tex. Dad would take ,10/29/2002,N,,https://nuforc.org/sighting/?id=25857
70359,09/15/1953 14:00,Homer,PA,USA,,"9 53  Father had cigar shaped ufo keep pace with his Piper Cub, in Homer Alaska, then it sped away.",06/04/2009,N,,https://nuforc.org/sighting/?id=70359
136474,09/15/1953 00:00,Monroe,NY,USA,Oval,"I was about 12 years old,walking with my dog close to a swamp at 10am all became deathly silent. I looked up to my right at  an oval de",09/30/2017,N,,https://nuforc.org/sighting/?id=136474
178333,09/03/1953 08:35,Winchester,MA,USA,Disk,This happened when I was 6 years old and told not to say anything cause i would be called a nut.,09/17/2023,N,,https://nuforc.org/sighting/?id=178333
41949,08/15/1953 21:00,Bowleys Quarters,MD,USA,Sphere,The speed of these speres were unbelievable they held formation stationary then bursted one by one into space,02/14/2005,N,,https://nuforc.org/sighting/?id=41949
